{
  "identity": { "status": "inferred", "contentHash": "ni:///sha-256;note789" },
  "creator": "SELF",
  "body": "Remember: the grounding moat is the wedge, not the recipe parser.",
  "mediaKind": null,
  "contentForm": "note",
  "saves": [
    {
      "sources": [{ "kind": "manual", "at": "2026-07-08T09:15:00Z" }],
      "annotations": [
        { "body": "core thesis", "createdAt": "2026-07-08T09:16:00Z" }
      ]
    }
  ]
}
